{
  "name": "reversal_cube",
  "dim": 2,
  "stages": [
    {
      "name": "response_map",
      "kind": "response",
      "matrix": [[1, 0], [0, 1]]
    }
  ],
  "targets": [
    {
      "name": "target",
      "rows": [[1, 0]]
    }
  ],
  "probes": [],
  "claims": [],
  "reversals": [
    {
      "n": 2,
      "cube": [1, -1, -1, 1],
      "forbidden_masks": [3],
"state_dim": 2,
    "reversal_maps": [
      [[1, 0], [0, 1]],
      [[1, 0], [0, 1]]
    ]
    }
  ],
  "reference": null
}