{
  "name": "refactor_b",
  "dim": 2,
  "stages": [
    {
      "name": "full_state_preserved",
      "kind": "response",
      "matrix": [[1, 0], [0, 1]]
    },
    {
      "name": "fiber_readout",
      "kind": "probe_projection",
      "matrix": [[1, 0], [0, 0]]
    }
  ],
  "targets": [
    {
      "name": "chiral_correlator",
      "rows": [[1, 0]]
    }
  ],
  "probes": [],
  "claims": [],
  "reversals": [],
  "reference": null
}