{
  "name": "stress_target",
  "dim": 2,
  "stages": [
    {
      "name": "channel_x1",
      "kind": "source",
      "matrix": [[0, 1], [0, 0]]
    }
  ],
  "targets": [
    {
      "name": "C",
      "rows": [[1, 0]]
    }
  ],
  "probes": [
    {
      "name": "B_sig",
      "rows": [[0, 1], [0, 10000]]
    },
    {
      "name": "B_tar",
      "rows": [[0, 1], [100, 1]]
    }
  ],
  "claims": [],
  "reversals": [],
  "reference": null
}