{
  "name": "claim_matrix_mnsi_collinear",
  "dim": 2,
  "stages": [
    {
      "name": "response_map",
      "kind": "response",
      "matrix": [[1, 0], [0, 1]]
    }
  ],
  "targets": [
    {
      "name": "C",
      "rows": [[1, 0]]
    }
  ],
  "probes": [
    {
      "name": "fm",
      "rows": [[1, 0], [0, 1]]
    },
    {
      "name": "src",
      "rows": [[1, 0], [0, 1]]
    },
    {
      "name": "exch",
      "rows": [[1, 0], [0, 1]]
    },
    {
      "name": "gapped",
      "rows": [[1, 0]]
    },
    {
      "name": "rev",
      "rows": [[1, 0], [0, 1]]
    },
    {
      "name": "kern",
      "rows": [[1, 0], [0, 1]]
    }
  ],
  "claims": [
    { "component": "M", "status": "closed", "channel": "fm", "focus": "C" },
    { "component": "S", "status": "open", "channel": "src", "focus": "C" },
    { "component": "E", "status": "closed", "channel": "exch", "focus": "C" },
    { "component": "X", "status": "closed", "channel": "gapped", "focus": "C" },
    { "component": "R", "status": "closed", "channel": "rev", "focus": "C" },
    { "component": "K", "status": "closed", "channel": "kern", "focus": "C" }
  ],
  "reversals": [],
  "reference": null
}