{
  "name": "intervention",
  "dim": 2,
  "stages": [
    {
      "name": "polarizer_first",
      "kind": "probe_projection",
      "matrix": [[1, 0], [0, 0]]
    }
  ],
  "targets": [
    {
      "name": "chiral_correlator",
      "rows": [[1, 0]]
    }
  ],
  "probes": [
    {
      "name": "U_swap",
      "rows": [[0, 1], [1, 0]]
    }
  ],
  "claims": [],
  "reversals": [],
  "reference": null
}