{
  "name": "mnf2_sector",
  "dim": 2,
  "stages": [
    {
      "name": "response_map",
      "kind": "response",
      "matrix": [[1, 0], [0, 1]]
    }
  ],
  "targets": [
    {
      "name": "dj7_odd",
      "rows": [[1, -1]]
    }
  ],
  "probes": [],
  "claims": [],
  "reversals": [],
  "reference": {
    "operator_dim": 2,
    "group": [
      [[1, 0], [0, 1]],
      [[0, 1], [1, 0]]
    ],
    "target": [[1, -1]],
    "declared": {
      "independent": true,
      "state": true,
      "no_retune": true
    },
    "odd_direction": [1, -1],
    "characters": [1, -1]
  }
}